Date,Text
10/2/2025,"Ethereum may also lack fundamental blockchain activity for an Ether price recovery, analysts told Cointelegraph."
10/2/2025,"Bitcoin digests tariffs, sell-offs and more as its price action clings to the center of its three-month range."
10/2/2025,Crypto markets have been steadily recovering after a brief dip in the wake of more tariff announcements from US President Donald Trump.
10/2/2025,Bitcoin holders with no record of selling their holdings have increased their BTC reserves during the Trump-led market rally.
10/2/2025,"A Welsh landfill site where a hard drive purportedly containing 8,000 Bitcoin is buried is set to shut."
10/2/2025,BTC price momentum is still lacking as the active Bitcoin trading range gets ever narrower.
10/2/2025,"Ether and other altcoins saw a massive week of ETP inflow, while Bitcoin inflows continued to decline, according to data from CoinShares."
10/2/2025,Coinbase is among several top US crypto firms scheduled to report earnings this week.
10/2/2025,"Ethereum researcher Justin Drake says ETH issuance will decrease while the Bitcoin network will eventually be hampered by its supply cap, leading to debate on X."
10/2/2025,"Strategy’s fresh 7,633-BTC purchase came days after the firm rebranded from “MicroStrategy” last week."
10/1/2025,"US Federal Reserve officials are adopting a “neutral” policy stance, pointing to strong economic performance and awaiting more clarity on Donald Trump’s policies."
10/1/2025,"Real Vision CEO Raoul Pal says the next phase will be an altcoin season “when everything goes up,"" followed by a bigger consolidation."
10/1/2025,"The registered crypto trading firm allegedly stole “hundreds of millions of baht” from electricity providers, amounting to at least $2.88 million."
10/1/2025,"In an interview with Cointelegraph, US Senator Ted Cruz discusses Bitcoin’s role in driving small business growth, its potential as a hedge against inflation and why Texas is becoming a top crypto hub."
10/1/2025,"Canadian spot Bitcoin ETF investors have been flocking to more liquid US alternatives, triggering the largest crypto ETF outflows in Canada’s history."
10/1/2025,Bitcoin ends a run of 14 consecutive green candles as markets price out the odds of further interest rate cuts in 2025.
10/1/2025,The Bitcoin seized from former ICRF employee Marat Tambiev will be turned into Russian state revenue.
10/1/2025,"The market sentiment index score hasn’t been in the ""Neutral"" zone since Oct. 14, when Bitcoin was trading at around $63,000."
10/1/2025,"Many executives and analysts predicted the success of US spot Bitcoin ETFs in 2024, but the funds surpassed expectations."
10/1/2025,"According to Satoshi Action Fund CEO Dennis Porter, the North Dakota BTC bill “already has 11 sponsors.”"
10/1/2025,"The Bitcoin Act’s passage could eventually send BTC’s price past $1 million per coin, industry executives say."
10/1/2025,"“Due to its verifiable fixed supply, Bitcoin is the most inflation-resistant store of value available,” the proposal read."
10/1/2025,"Bitcoin short-term holders are potentially giving the market a classic ""buy the dip"" signal, new research from CryptoQuant says."
10/1/2025,"The upcoming US presidential inauguration could be a positive catalyst, the asset manager said."
10/1/2025,"Bitcoin price is chasing $95,000 after showing modest gains today as several onchain BTC metrics are hinting at signs of a potential bottom."
10/1/2025,"Bitcoin’s bounce above $94,000 suggests that the bulls remain buyers on dips, increasing the possibility of a retest of $100,000."
10/1/2025,More than half of wealth advisers in the United States surveyed by Bitwise say they’re more open to investing in cryptocurrency after Trump won the presidential election in November.
10/1/2025,"Bitcoin whales, an increase in speculative appetite and other macroeconomic factors are playing a role in keeping BTC price above $90,000."
10/1/2025,"CleanSpark joins MARA Holdings, Riot Platforms and Hut 8 Mining as a major listed Bitcoin mining firm with 10,000 Bitcoin or more on its balance sheet."
10/1/2025,"Jan. 10 marks the one-year anniversary of the spot Bitcoin ETF launches. After a belt-busting year that saw $129 billion in inflows, can the EFTs do it again?"
9/30/2025,"Bitcoin bulls began a battle to flip three moving averages back to support at the start of the week, the latest BTC price analysis confirmed."
9/30/2025,"SOL late leverage longs got rinsed by the flash crash to $205, but data shows pro traders buying the dip and retail traders opening fresh spot and margin positions."
9/30/2025,"Bitcoin derivatives markets show heightened caution amid weak macroeconomic data, but Bitcoin ETF inflows and corporate accumulation signal bullishness."
9/30/2025,"Bitcoin moves closer to a positive monthly close, which has historically been followed by strong double-digit rallies in Q4. Is $170,000 possible by the end of 2025?"
9/30/2025,"The Bitcoin community is split over Bitcoin Core v30’s plan to drop the 80-byte OP_RETURN limit, a dispute started by Nakamoto’s arbitrary data restrictions."
9/30/2025,"Strategy has slowed down its Bitcoin acquisition strategy with smaller buys this month, while the number of crypto millionaires grows closer to a quarter million."
9/30/2025,"Bitcoin price traded at $113,900 after showing modest gains on Tuesday as several BTC metrics hinted at a potential bottom."
9/30/2025,Bitcoin trade revealed that BTC price action could be ready to follow gold to new all-time highs after bulls held onto early-week gains.
9/29/2025,"Cypherpunk Nick Szabo has posted on X after five years of silence, adding his views to a fierce debate between Bitcoin purists and maximalists."
9/29/2025,"Bitcoin opened the week with a strong rally above $114,000, and these three developments could send BTC price back to its monthly range highs"
9/29/2025,"Poland’s Crypto-Asset Market Act awaits Senate review after Sejm approval, sparking a backlash over licensing, fines and potential prison terms for violations."
9/29/2025,"Introduced by a Republican lawmaker in February, the legislation may be unlikely to get any traction in the Massachusetts legislature, where Democrats hold a supermajority."
9/29/2025,"Bulls lift their short-term Bitcoin price target to $117,500 as BTC holds steady and several altcoins reclaim the pre-crash trading levels."
9/29/2025,"Strategy’s $22.1 million Bitcoin purchase brought the company’s total Bitcoin holdings to 640,031 BTC, acquired for about $47.35 billion."
9/29/2025,"Bitcoin and Ether ETPs suffered heavy outflows last week while Solana stood out with $291 million in inflows, likely driven by anticipation of US ETF launches."
9/29/2025,"Bitcoin’s swift rally to $114,000 shows bulls are back, but a CME gap near an underlying support could see a retest of $111,000 before Uptober really starts."
9/29/2025,"Bitcoin rebounded to $112,000 into the weekly close, but traders immediately positioned for a BTC price correction to the bottom of its local range."
9/29/2025,"Bitcoin hit $114,000 at Monday’s Wall Street open, but a CME gap made traders cautious, instead expecting a BTC price correction to $110,000."
9/29/2025,"Bitcoin failed to follow gold to all-time highs this month, but analysts argue that BTC usually follows three to four months later, setting targets as high as $300,000."
9/29/2025,"Bitcoin briefly surpassed $112,000 in a sign of recovery after a volatile week, prompting one analyst to say the cryptocurrency was still in an uptrend."
9/28/2025,"A CoinGecko survey published on Monday found that 10% of respondents have never bought Bitcoin, and only 54% of newcomers started with it in their stash."
9/28/2025,"Bitcoin will perform like Nvidia and record several major corrections on its path to new all-time highs, analyst Jordi Visser said."
9/28/2025,"Sound money forces governments and individuals to embrace fiscal discipline, while currency inflation encourages reckless spending."
9/28/2025,"Singapore and the UAE rank as the world’s most crypto-obsessed countries amid high ownership, search activity and rapid adoption growth."
9/28/2025,"Nation-state Bitcoin adoption is at the “tail end"" of the gradual stage and entering ""the beginning phases of suddenly,"" Jan3 founder Samson Mow said."
9/27/2025,"Mike Novogratz said “of course” Bitcoin could reach $200,000 if the Federal Reserve adopts a highly dovish stance following a leadership change."
9/27/2025,"Bitcoin struggles to recover and rally despite favorable macroeconomic trends that have sent stock prices higher. What will it take to overcome $110,000?"
9/27/2025,Investor psychology has not changed in the ensuing 25 years since the dotcom-era bust that took down the US stock market in the early 2000s.
9/27/2025,"Traditional financial instruments cushion volatility and attract institutional investors to Bitcoin, a sign of market maturation."
9/27/2025,"Retail and quants are fueling DEXs like Hyperliquid, while CEXs hold institutional ground. Aster’s rise adds new pressure to the onchain race."
9/27/2025,"Despite numerous calls for higher BTC prices in October, Bitcoin would repeat history with a steep drop toward $60,000 first."
9/27/2025,"Creating a national Bitcoin reserve could prove disastrous for markets, as it would signal an immediate shift in the global financial order."
9/26/2025,"BlackRock filed a registered trust company to back its proposed Bitcoin Premium Income ETF, a yield-generating product that would complement its $87 billion spot Bitcoin ETF, IBIT."
9/26/2025,"Favorable policy shifts, growing ETP access, and stablecoin momentum could be the key themes for the crypto market coming into Q4, analysts told Cointelegraph."
9/26/2025,"Bitcoin is down 5%, its sharpest weekly drop since March, but October seasonality and long-term holder stability suggest a potential recovery ahead."
9/26/2025,"According to Grayscale, some market sectors benefited from significant changes to US policy in the third quarter, but Bitcoin underperformed compared to Ether and others."
9/26/2025,"Although crypto treasury companies have enjoyed short-term price gains, most have underperformed the underlying assets they hold."
9/26/2025,"Bitcoin showed no sign of a major rebound after the release of major US inflation data, with bid liquidity clustered at $108,200."
9/26/2025,"Crypto sentiment gauge, the Crypto Fear & Greed Index, collapsed below 30/100 for the first time since mid-April, with Bitcoin trading $25,000 higher."
9/26/2025,"Bitcoin dropped to under $109,000 as long-term holders realized 3.4 million Bitcoin profits and ETF inflows slowed, signalling potential cycle exhaustion."
9/26/2025,"Bitcoin and several major altcoins are trying to start a recovery, but they are likely to be met with significant selling pressure at higher levels."
9/25/2025,"Among the bets the characters made in the animated series were on school lunches, geopolitical conflicts and a fictional baby’s gender."
9/25/2025,"US spot Bitcoin ETF flows cooled after strong inflows, signalling weaker institutional demand that could push BTC price into an extended correction."
9/25/2025,"Kadan Stadelmann, chief technology officer at Komodo Platform, told Cointelegraph that treasury companies are competing to see who can create the most enticing structure."
9/25/2025,"Stablecoin payments firm RedotPay said it became a fintech unicorn after a $47 million round with participation from Coinbase Ventures, Galaxy Ventures and Vertex Ventures."
9/25/2025,"Bitcoin and altcoins failed to follow gold and stocks to all-time highs this month, partly because of a lack of stablecoin liquidity on cryptocurrency exchanges."
9/25/2025,"A DAO member flagged risks and transparency issues, but Curve founder Michael Egorov said audits and safeguards address them."
9/25/2025,"Bitcoin fell to new local lows on the back of strong US jobs data, joining stocks and gold in what analysis called an “overdue” correction."
9/25/2025,"Bitcoin price tumbled toward new lows below $109,000 and while charts suggested the sell-off is far from over, data shows spot buyers accelerating their accumulation."
9/25/2025,"Bitcoin fell to a three-week low under $109,000, but the $22 billion end-of-month options expiry could lead to a much-needed BTC price bounce."
9/25/2025,Researchers at banking giant HSBC said they successfully applied quantum computers to algorithmic bond trading in an experimental test.
9/24/2025,"Bitcoin’s $22.6 billion monthly options expiry is led by bulls, but macroeconomic headwinds could give the bears a last-minute advantage."
9/24/2025,"Bitcoin whale distribution and a weakening technical structure could push BTC price into an extended sell-off toward $100,000."
9/24/2025,"The number of crypto millionaires has jumped 40% year-on-year to over 240,000, driven mainly by institutional adoption, according to Henley & Partners."
9/24/2025,"Growing Wall Street crypto adoption and agentic AI platforms may catalyze a “supercycle” for Ethereum, according to BitMine, the largest corporate holder of Ether."
9/24/2025,"Bitcoin’s Bollinger Bands compressed to record-tight weekly levels, with analysts predicting inevitable volatility expansion and major price movement."
9/24/2025,Strategy chair Michael Saylor says Bitcoin will gain after “macro headwinds” subside as treasury companies and ETFs put upward pressure on the cryptocurrency.
9/24/2025,"Kraken committed $2 million to Freedom Fund PAC and America First Digital, citing a need to defend crypto users’ rights in the US."
9/24/2025,"Bitcoin’s bullish divergences on the RSI metric, along with record-low volatility, were early signs that the rally to $113,900 was in the making. Is the sell-off over?"
9/24/2025,"Bitcoin traders supplied BTC price levels to cause “max pain” around a giant $17.5 billion options expiry, while Bollinger Bands set new records."
9/24/2025,"Bitcoin bulls are trying to seize control but are expected to face strong selling at $117,500. Will altcoins capitalize on BTC's potential range-bound price action?"
9/24/2025,"Bitcoin Core proponents defend OP_RETURN changes as neutral, while critics warn of spam and capture."
9/23/2025,"Arthur Hayes made a fresh BTC price prediction, seeing Bitcoin “markedly higher” in three years’ time, but not at $3.4 million per coin."
9/23/2025,Glassnode warned that Bitcoin profit-taking behavior mirrors past bull market cycle peaks. Should investors expect more all-time highs?
9/23/2025,"Bitcoin traders revealed new BTC price bottom targets as BTC price action wobbles, while a dovish Fed speech offered bulls little relief."
9/23/2025,BlackRock’s Bitcoin and Ether ETFs are generating over a quarter of a billion dollars for the world’s largest asset manager as the next potential adoption “benchmark” for TradFi.
9/23/2025,"Sygnia CEO Magda Wierzycka says her firm calls investors if they allocate too much into their Life Bitcoin Plus ETF, which launched in June."
9/23/2025,"The latest Bitcoin price pullback toward $112,000 was likely a buy-the-dip opportunity with BTC set to recover, several key market metrics suggest."
9/23/2025,"CZ’s $10 billion fund, YZi Labs, was reported to be exploring external capital amid rising investor demand and a more open regulatory stance in the US."
9/23/2025,"After its best quarter to date, CleanSpark is scaling up operations with another $100 million worth of financing from Coinbase."
9/23/2025,"Over $1.8 billion was flushed in one of the year’s most significant long liquidation events — and one analyst says Bitcoin dipping back to around $103,000 is possible."
9/23/2025,"Investors didn’t take too kindly to new crypto acquisitions from treasury companies on Monday, while announcements from crypto-pivoting businesses had the opposite effect."
9/23/2025,"Data supports the view that Bitcoin trades at a discount, and traders are buying the dip, but charts still warn of a potential sell-off to $106,000."
9/22/2025,"Strive’s $675 million Bitcoin buy and Semler merger create a 10,900 BTC treasury company, making it one of the world’s top corporate BTC holders."
9/22/2025,"Bitcoin dropped to 12-day lows on Monday despite analysts hyping “Uptober” rally potential, though not all are confident that next month will be up only."
9/22/2025,"Bitcoin slips under $111,500 as $280 million in leverage long positions are liquidated, but key support levels may decide if BTC rebounds or risks a deeper breakdown."
9/22/2025,"US steps in with a lifeline as Argentina battles peso turmoil, investor flight and President Javier Milei’s waning credibility. Crypto adoption surges."
9/22/2025,"Strategy’s latest $99.7 million Bitcoin acquisition brought its total Bitcoin holdings to 639,835 BTC, acquired for about $47.3 billion."
9/22/2025,"Metaplanet became the world’s fifth-largest corporate Bitcoin holder after buying 5,419 BTC, bringing its total to 25,555 BTC worth nearly $3 billion."
9/22/2025,"Bitcoin ETFs drove crypto fund gains last week, posting four consecutive weeks of inflows totaling $3.9 billion, according to SoSoValue."
9/22/2025,"Bitcoin’s drop to $112,000 saw significant liquidations of late longs, with onchain metrics suggesting that BTC’s bullish conviction was fading."
9/22/2025,"Bitcoin dipped to $112,000 to start the week, and crypto traders suffered $1 billion of liquidations in a bearish new record for 2025."
9/22/2025,"Hyperliquid’s HYPE token faces a monthly supply overhang of $410 million due to its vesting schedule, warned Arthur Hayes’ Maelstrom Fund."
9/22/2025,"Bitcoin’s sharp fall resulted in the biggest long liquidation in a 24-hour period, and the sell-off pulled many altcoins below their immediate support levels."
9/21/2025,"Bitcoin market participants saw the area at $117,200 and above as particularly important heading into the weekly close and fresh US macro data."
9/21/2025,Song accused BTC Core developers of defecting and failing to address widespread community concerns about non-monetary data on the ledger.
9/20/2025,Liquidity is set to flow into private financial markets once the United States Treasury fills its General Account with $850 billion.
9/20/2025,BTC will continue to appreciate and gain adoption as the global financial and geopolitical system is reshaped in the coming decades.
9/20/2025,The rising network difficulty and the need to pay for energy are pushing out smaller players and even publicly traded corporations.
9/20/2025,"HashKey Capital CEO Deng Chao says crypto treasuries must be treated as strategic reserves, not speculative bets, to remain sustainable in volatile cycles."
9/20/2025,"Coinbase CEO Brian Armstrong has outlined plans to build a crypto super app, offering credit cards, payments and Bitcoin rewards to rival traditional banks."
9/20/2025,"BitGo files to go public with $90.3 billion in assets under custody, targeting NYSE listing as institutional crypto adoption accelerates under new US policies."
9/20/2025,Strategy's Michael Saylor said that lower Bitcoin volatility benefits “mega institutions” but disappoints thrill-seekers who thrive on price swings.
9/20/2025,Economist Timothy Peterson said that the US Federal Reserve's upcoming actions are likely to “jolt Bitcoin and alts up substantially.”
9/19/2025,Vietnam is reportedly closing 86 million bank accounts. Crypto advocates see it as the latest reason everyone should hold Bitcoin.
9/19/2025,"Nearly a decade after losing access to his Coinbase account, NBA star Kevin Durant is once again in control of his Bitcoin holdings, according to the exchange CEO."
9/19/2025,"Into The Cryptoverse founder Benjamin Cowen said such a steep drawdown isn’t guaranteed, but “history would at least caution us.”"
9/19/2025,"Michigan’s crypto reserve bill has advanced to the committee stage, allowing 10% state investment in digital assets."
9/19/2025,"Bitcoin can easily return to price “expansion” based on data from the NVT leading indicator, new BTC price research from CryptoQuant concluded."
9/19/2025,"Over 72 percent of circulating BTC is now illiquid, suggesting reduced sell-side pressure and a continued downtrend of Bitcoin supply on cryptocurrency exchanges."
9/19/2025,"Analysts are warning of a potential investor “recalibration” for short-term market volatility, which has historically occurred after US interest rate cuts."
9/19/2025,"Solana founder Anatoly Yakovenko forecasts a “50/50” chance of a quantum computing breakthrough by 2030, and says the Bitcoin community must “speed things up.”"
9/19/2025,"Public firms are raising hundreds of millions in capital for cryptocurrency strategies, reinforcing investor expectations of another historic altcoin market cycle."
9/19/2025,Bitcoin’s price pumped on news that the US Federal Reserve would cut rates by one quarter of a point.
9/19/2025,Bitcoin gained fresh downward BTC price predictions on the back of an options expiry event and thickening bid liquidity on exchange order books.
9/19/2025,"Bitcoin faced solid selling at $117,500, but the real test is whether bulls can maintain BTC price above $115,500. Meanwhile, most altcoins are expected to rise higher."
9/19/2025,"The European Union is looking to block Russian crypto transactions, marking the first time that sanctions have directly targeted cryptocurrency platforms."
9/18/2025,"After stepping down in 2023 as part of a deal with US officials that later sent him to prison, Changpeng Zhao said he had “no plans to return to the CEO position” at Binance."
9/18/2025,"While earning yield on Bitcoin holdings is still a novelty, there are opportunities to do so through centralized lending platforms and Bitcoin-related networks."
9/18/2025,"Colombians will soon be able to receive and store USDC through MoneyGram’s new crypto app, which will launch soon in app stores."
9/18/2025,Livestreamers on Pump.fun placed a golden statue of Donald Trump holding a Bitcoin outside the US Capitol as part of a memecoin stunt.
9/18/2025,Macro analyst Luke Gromen’s comments come amid an ongoing debate over whether Bitcoin or Ether is the more attractive long-term option for traditional investors.
9/18/2025,"Rich Dad, Poor Dad author Robert Kiyosaki says he believes in accumulating gold, silver, oil, Bitcoin and Ether, which he deems “hard money.”"
9/18/2025,"The SEC approved Grayscale’s Digital Large Cap Fund, the first US multi-asset crypto ETP offering exposure to Bitcoin, Ether, XRP, Solana and Cardano."
9/18/2025,"Bitcoin copies moves that led to its latest all-time highs, but analysis warns that the path to price discovery will not be easy."
9/18/2025,"One analyst said BTC has a 70% chance of hitting new highs in the next two weeks, but data also points to growing liquidity at $114,000. Which path will BTC take first?"
9/18/2025,Bitcoin has a new key resistance zone to flip back to support as US Fed rate-cut reactions continue to play out in crypto bulls' favor
9/17/2025,"LMAX Group entered the crypto derivatives arena with 100x leveraged perpetual futures for institutional investors, citing increased demand for these tools."
9/17/2025,"The Bitcoin options market reflected caution, while top traders increased their bullish positions as optimism for a Federal Reserve rate cut grew."
9/17/2025,"Powell said the US Federal Open Market Committee is weighing interest rates on a meeting-by-meeting basis, with no long-term consensus."
9/17/2025,Japan’s Metaplanet launched subsidiaries in Miami and Tokyo to grow Bitcoin income and expand domestic crypto media operations.
9/17/2025,"Shares in GD Culture fell 28% after the livestreaming company made a deal to swap tens of millions of its shares to acquire 7,500 Bitcoin from Pallas Capital."
9/17/2025,"There’s division among crypto analysts over how Bitcoin will react to the Fed’s decision on Wednesday, whether or not a rate cut is announced."
9/17/2025,"Donald Trump’s latest Fed pick cited a “third mandate” for the bank to moderate long-term rates, potentially justifying yield curve control policies, which could boost Bitcoin."
9/17/2025,A dormant Bitcoin whale moved $116 million of the cryptocurrency ahead of the Fed’s key interest rate decision as crypto traders braced for volatility in global markets.
9/17/2025,"Bitcoin rose above $117,000 as investors braced for Jerome Powell’s post-FOMC speech that could see volatile swings toward key BTC price levels."
9/17/2025,Bitcoin is working on its second-best September performance ever as this bull market increasingly stands out from those before it.
9/17/2025,"Bitwise’s Matt Hougan says a more straightforward SEC listing process could lead to more crypto ETFs, but that doesn’t mean they’ll all attract money."
9/17/2025,"Blockchain stakeholders may still negotiate with policymakers on the EU AML framework’s upcoming ban on privacy-preserving tokens, set to go into effect in 2027."
9/17/2025,"Bitcoin’s volatility may rise after today’s FOMC, but it is unlikely to result in a new directional move, hinting at continued range-bound action for a few more days."
9/17/2025,Market participants are eagerly anticipating at least a 25 basis point (BPS) interest rate cut from the Federal Reserve on Wednesday.
9/17/2025,"Bitcoin struggled to hold the $115,000 level even after a Federal Reserve policy pivot brought about a long-awaited 25-basis point interest rate cut."
9/17/2025,Lawmakers in the US House of Representatives and Senate met with cryptocurrency industry leaders in three separate roundtable events this week.
9/16/2025,"Crypto Finance, part of the Deutsche Börse Group, launched AnchorNote to let institutions trade across venues without moving assets out of custody."
