Date,Text
7/3/2025,"Thousands of Bitcoin mining machines had been reportedly seized as US ports of entry since as early as September, but there’s been conflicting information surrounding why."
7/3/2025,US President Donald Trump signed an executive order establishing both a “Strategic Bitcoin Reserve” and a “Digital Asset Stockpile.”
7/3/2025,"The wallet went dormant with 5,000 BTC after the marketplace, which facilitated drug and weapons sales, went down in April 2016."
7/3/2025,Treasury Secretary Bessent signaled that he would explore ways to acquire additional Bitcoin at the White House Crypto Summit on March 7.
7/3/2025,Bitcoin bulls are already reclaiming a BTC price slide that came after the Bitcoin Strategic Reserve executive order fell short of market expectations.
7/3/2025,"Swan Bitcoin CEO Cory Klippsten tells Cointelegraph that while Bitcoin is in a consolidation phase, he doesn’t see that “stretching into long-term sideways movement.”"
7/3/2025,The White House Crypto Summit brings top industry leaders together as President Trump’s Bitcoin reserve plans spark debate over the future of crypto policy in the US.
7/2/2025,"House Bill 1217, introduced by Representative Ben Keathley, aims to establish a Bitcoin reserve fund for Missouri and mandate crypto acceptance for state payments."
7/2/2025,"The Franklin Crypto Index ETF seeks to provide exposure to the spot prices of Bitcoin and Ether, following a similar filing by Bitwise just weeks earlier."
7/2/2025,BTC price strength faces further risks as prediction markets see a giant beat on US January jobs.
7/2/2025,"Japan’s Financial Services Agency said the action was not about “shutting down crypto investing,” but “drawing a line in the sand” for noncompliant exchanges."
7/2/2025,BlackRock's investment comes a day after the world’s largest corporate Bitcoin holder rebranded from MicroStrategy to Strategy.
7/2/2025,Binance CEO Richard Teng emphasized the role of institutional investors and evolving regulations in making crypto an essential part of the financial system.
7/2/2025,Bitcoin decides that bad news is good news as a mixed US employment outlook sends BTC price action back to six figures.
7/2/2025,"CleanSpark’s Bitcoin treasury strategy is paying off; the company held 10,556 in self-mined BTC at the end of 2024."
7/2/2025,0G launched an $88 million ecosystem fund for DeFi AI agents as markets bled more than $10 billion in daily liquidations.
7/2/2025,"The market has already priced in less accommodating interest rate policy, and legislative tailwinds could aid Bitcoin’s performance."
7/2/2025,Kentucky’s bill is a “massive vote of confidence in Bitcoin” that brings the US closer to a federal Bitcoin reserve.
7/1/2025,"Bitcoin price sold-off today, but heavy demand below $98,000 is prepping the market for the next leg higher."
7/1/2025,The venture firm expects 2025 to see a proliferation of tokenized securities and the emergence of AI agent “alpha hunters.”
7/1/2025,CoinSwitch expects it will take two years to distribute $70 million in recovery funds to WazirX users who lost money due to an alleged cyberattack last year.
7/1/2025,"While the spot Bitcoin ETFs smashed industry expectations in 2024, the products finished poorly with outflows in six of the last eight trading days."
7/1/2025,"Emerging crypto regulation and the US Federal Reserve’s monetary policy path will be the main drivers of Bitcoin’s price trajectory in 2025, Binance Research told Cointelegraph."
7/1/2025,Bitcoin is shifting traders' expectations by holding six figures as bullish BTC price patterns return to the radar.
7/1/2025,"As part of the acquisition, Backpack EU will be responsible for distributing court-approved bankruptcy claims to FTX EU customers."
7/1/2025,"Bitcoin analysis blames “spoofing” for a snap BTC price correction of more than $4,000 in hours."
7/1/2025,"In 2024, the combined market capitalization of public Bitcoin mining companies reached $50 billion for the first time."
7/1/2025,"“We’re seeing people up and down the Cabinet who have been supportive of digital assets, innovation, and AI,” said TRM Labs’ Ari Redbord."
7/1/2025,"Spot Bitcoin ETFs in the United States amassed a whopping 51,500 BTC in December, while only a fraction of that number was mined."
7/1/2025,"The central bank governor, Aleš Michl, recently said he was considering investing in Bitcoin as part of the bank’s diversification strategy."
6/30/2025,"Bitcoin continues to face sellers at $109,000 even as most traders anticipate all-time highs and select altcoins rally at the start of the week."
6/30/2025,"Bitcoin could break past $110,000 as inflation pressures mount, equities rally, and passive capital flows grow on potential S&P 500 rebalancing events."
6/30/2025,"A trader under the handle qwatio has been liquidated eight times in the last week, with the latest a partial liquidation of an Ether position leveraged by 25X."
6/30/2025,"Long-term Bitcoin holders have been selling to institutions since spot ETFs launched, keeping prices stagnant."
6/30/2025,Bitcoin price action slides between increasingly thick walls of exchange order-book liquidity with just hours before two key candle closes.
6/30/2025,"BitMine Immersion Technologies raised $250 million through a private placement to establish an Ethereum treasury, signaling a shift from its previous Bitcoin-centric approach."
6/30/2025,"Onchain data points to a major Bitcoin price rally in the making, while short-term price weakness highlights the absence of “new” buyers."
6/30/2025,"Bitcoin's price hovered around $107,000, showing technical strength as BTC’s chance of rising to new all-time highs appears to be increasing, new analysis suggested."
6/30/2025,"Bitcoin is on the cusp of beating several historical all-time highs as a trader warns that ""games are being played"" in an increasingly volatile environment."
6/30/2025,"Michael Saylor’s Strategy now holds 597,325 BTC, purchased for about $42.4 billion at an average price of $70,982 per coin."
6/30/2025,"Crypto ETPs saw $17.8 billion of inflows in the first half of 2025, down 2.7% from last year’s $18.3 billion, according to CoinShares."
6/30/2025,Cointelegraph is in the Kingdom of Bhutan to check the state of crypto adoption in the eastern Himalayan country.
6/30/2025,"Metaplanet has become the fifth-largest corporate Bitcoin holder after its latest $108 million purchase, which comes on the same day the Japanese firm issued 0% interest bonds to buy more."
6/30/2025,"Kazakhstan’s central bank is set to establish a state-run crypto reserve, likely funded by seized digital assets and government-linked mining."
6/29/2025,Jordi Visser argued that growing dissatisfaction among those 25 and younger with the current financial system will increase BTC adoption.
6/29/2025,Human Rights Foundation’s Alex Gladstein told a group of US political leaders that Bitcoin has “essentially saved” citizens living under dictatorships.
6/29/2025,"Bitcoin price made a weekend rush on the $109,000 resistance and HYPE, BCH, LINK and SEI could be the first altcoins to rally if BTC bulls secure new highs."
6/29/2025,"Michael Saylor's Strategy is up over 52% on its Bitcoin investment, representing an unrealized capital gain of over $21.8 billion."
6/29/2025,Kenya’s crypto startups fear a Binance-linked lobby group could tilt new regulations in the exchange’s favor under the proposed VASP bill.
6/29/2025,"More than 25% of South Koreans aged 20 to 50 now hold crypto, and 70% plan to increase their investments as digital assets become a key part of retirement planning."
6/29/2025,"Bitcoin weekend volatility gets a late boost thanks to a familiar source with the key $109,000 BTC price closing level within easy reach."
6/28/2025,"Bitcoin treasury companies have become a major trend in 2025; however, only the most seasoned and disciplined firms are likely to survive."
6/28/2025,The crypto exchange company is often used as a proxy to gauge the health and growth of the nascent crypto industry in the United States.
6/28/2025,Trump praised Bitcoin and cryptocurrencies in a Friday press conference and said Bitcoin may help relieve pressure on the US dollar.
6/28/2025,"Dwayne Golden sentenced to nearly eight years for defrauding investors in EmpowerCoin, ECoinPlus, and Jet-Coin schemes totaling over $40 million."
6/28/2025,"Gemini says Strategy (MSTR) is its only tokenized stock for now, with more tokenized stocks and ETFs launching in ""the coming days."""
6/28/2025,"Bitcoin trades near key support at $104,000, but weak volume, fading onchain metrics, and sticky inflation point to more price consolidation."
6/28/2025,"Crypto cards now rival banks for everyday purchases in Europe, with nearly half of transactions under $12 and online spending far above the eurozone average."
6/27/2025,Bakkt has filed for a $1 billion shelf registration after the firm updated its investment policy earlier this month to allow it to buy Bitcoin and other cryptocurrencies.
6/27/2025,Bitcoin Treasury Corporation completed a $92 million raise and bought 292.8 BTC ahead of its trading resumption on the TSX Venture Exchange.
6/27/2025,"US stock futures have hit record highs, fueling analyst predictions that Bitcoin could soon break past resistance to hit a new price peak."
6/27/2025,UK-based The Smarter Web Company has made a multimillion-dollar raise just days after it purchased $20 million worth of Bitcoin to bring its holdings to over 540 BTC.
6/27/2025,"If successful, Genius Group’s $1 billion lawsuits could net shareholders $7 per share while boosting the company’s Bitcoin holdings by 5,000 BTC."
6/27/2025,Bit Digital’s stock plummeted after announcing a $150 million share sale and a transition from Bitcoin mining to Ethereum staking.
6/27/2025,"Bitcoin long-term holder supply has increased at a record rate over the past month, data from CryptoQuant reveals."
6/27/2025,"A crypto trader turned $6,800 into $1.5 million with a one-sided quoting strategy, dominating over 3% of maker volume on a major exchange in just two weeks."
6/27/2025,Robinhood continues to expand its crypto services offering with micro futures contracts on leading assets.
6/27/2025,"A weakening US economy and Fed rate cuts set the stage for Bitcoin’s next move, but, onchain data shows a fragile bull market missing retail demand. Could it return by fall?"
6/27/2025,"Crypto private key exploits and front-end protocol attacks account for 80% of the $2.1 billion worth of crypto that has been stolen so far this year, TRM Labs reports."
6/27/2025,Altcoins search for direction while Bitcoin looks on track to take a stab at new all-time highs.
6/26/2025,Hong Kong updated its digital asset strategy regarding stablecoin licensing and tokenization of real-world assets by introducing its LEAP framework for market growth.
6/26/2025,"Some users were questioning whether the Nano S would still work after support ends, and whether there was a security risk involved if they decided to keep using it."
6/26/2025,The crypto mining firm will additionally sell its own stock to purchase more ETH for its treasury.
6/26/2025,"Pradeep Bhandari, spokesperson for India’s ruling BJP party, called for a Bitcoin reserve pilot and clarity on the country’s “taxed but unregulated” approach to crypto."
6/26/2025,Macroeconomist Lyn Alden said the US dollar barely “got any flight-to-safety bid” despite recent geopolitical tensions between Iran and Israel.
6/26/2025,"One of the victims identified in the police operation said she carried around $13,000 in cash at one point to send Bitcoin to scammers via crypto ATMs."
6/26/2025,"Galaxy Digital raises $175 million for its first externally backed venture fund, targeting early-stage crypto startups."
6/26/2025,"Metaplanet has overtaken Tesla in corporate Bitcoin holdings, buying 1,234 BTC and bringing its total to 12,345 BTC as it eyes more expansion."
6/26/2025,"Pickup in MVRV momentum, profitability and onchain activity could push BTC above the next big hurdle at $110,000 into price discovery."
6/26/2025,"Bitcoin price all-time highs spark a sea change among larger miners, who instead of taking profits are actively adding to their BTC reserves."
6/26/2025,"Trump’s early Fed replacement plans rattled markets, accelerating dollar losses and sending DXY to its lowest level since April 2022."
6/26/2025,"British national Kai West, known online as “IntelBroker,” has been indicted for allegedly selling stolen data on BreachForums, causing over $25 million in damages."
6/26/2025,BTC price returns to retest recently reclaimed levels as Bitcoin analysis flags the 50-day moving average trend line as a “buying opportunity.”
6/26/2025,A Bitcoin price pattern with a high hit rate formed on the daily chart. Are new BTC all-time highs incoming?
6/26/2025,"Mounting macroeconomic risks, declining Bitcoin miner revenues, and cautious sentiment among investors could trigger a sharp BTC price correction."
6/26/2025,"Vincent Liu, the chief investment officer at Kronos Research, said buying Bitcoin alone isn’t enough to increase a company’s stock price; there needs to be a clear plan."
6/25/2025,US crypto stocks surged on Tuesday amid a shaky Donald Trump-brokered ceasefire agreement between Iran and Israel.
6/25/2025,"Bitcoin delivers a textbook liquidity grab, while traders eye a potential BTC price showdown with all-time highs next."
6/25/2025,"As tensions escalate around the globe, Byte-Sized Insight explores how crypto behaves in crisis, from Bitcoin’s market resilience to blockchain’s role in preserving journalism and dispersing aid."
6/25/2025,"Bitcoin’s price moves closer to its all-time high, but liquidity shortage could trigger a breakout toward $165,000."
6/25/2025,"Data shows spot Bitcoin ETF inflows are largely unhedged, pointing to real institutional investor conviction and BTC’s growing role as a macro-driven financial asset."
6/25/2025,"Bitcoin bulls appear poised to win the upcoming $20 billion options expiry, raising the chances for a rally to $110,000."
6/25/2025,Bitcoin price continues moving higher as a ceasefire between Iran and Israel holds and traders anticipate a round of interest rate cuts from the US Federal Reserve.
6/25/2025,"A sharp drop in BTC inflows to Binance could play a role in Bitcoin possibly rallying to $120,000."
6/25/2025,The head of the FHFA said his agency is considering how Bitcoin is counted in qualifying for a mortgage.
6/25/2025,"In what looks to be the most dramatic decline in three years, Bitcoin’s hashrate dropped over 15% between June 15 and Tuesday."
6/25/2025,Betting platform Polymarket is reportedly set to be valued at $1 billion in a $200 million raise led by Peter Thiel’s Founders Fund.
6/25/2025,"Anthony Pompliano’s crypto firm ProCap has purchased 3,724 Bitcoin after announcing a $1 billion plan to go public later this year."
6/25/2025,"Financial analyst Jeff Walton says Strategy’s odds of S&P 500 eligibility hinge on Bitcoin’s ability to remain above $95,240."
6/25/2025,"US spot Bitcoin ETFs log $588.6 million in daily inflows, extending an 11-day streak amid easing geopolitical tensions."
6/25/2025,Green Minerals says it will raise $1.2 billion to buy Bitcoin and plans to adopt blockchain technology in areas such as supply chain transparency and operational efficiency.
6/25/2025,Bitcoin exchange order books reveal a liquidity showdown in waiting as BTC price consolidates in a narrow range.
6/24/2025,"If Bitcoin continues to tumble this season, it will mark its fourth consecutive summer in the red, while TradFi aims to extend its winning streak to three."
6/24/2025,Bitcoin bullish catalysts are multiplying amid a Middle East ceasefire and new hopes of an earlier-than-expected Fed rate cut.
6/24/2025,"Trump may issue an executive order to protect crypto firms from banking discrimination, ending what some call Operation Chokepoint 2.0, according to The Wall Street Journal."
6/24/2025,"Institutional Bitcoin allocation is on the rise, while retail BTC holdings are falling in favor of altcoins with a strong ETF approval chances, such as XRP."
6/24/2025,"Bitcoin recovers as the Coinbase premium soars, but retail investors’ inflows are rising at Binance, and open interest is falling, proving that traders remain cautious."
6/24/2025,Bitcoin price is up on June 24 as multiple BTC market metrics show an improvement in investor sentiment.
6/24/2025,"Japan’s FSA proposed classifying crypto as financial products, potentially allowing ETFs and a flat 20% capital gains tax."
6/24/2025,"Under Operation Chokepoint 2.0, more than 30 technology and crypto companies were denied banking services in the US after the collapse of crypto-friendly banks in 2023."
6/24/2025,"Unlike Ledger’s previously released key recovery product, Ledger Recover, the new Ledger Recovery Key is always offline and doesn’t require identification."
6/24/2025,"The crypto market is up today, following Trump’s announcement that Israel and Iran had agreed to a ceasefire, prompting investors to shift back into risk-on mode."
6/24/2025,Panther Metals is planning a $5.4 million Bitcoin treasury and will use it as collateral to buy a mineral mining deposit in Canada and other commodities in the future.
6/24/2025,Huione Guarantee’s shutdown sent “shockwaves” through the ecosystem but also left a vacuum for other crypto darknet marketplaces to fill.
6/24/2025,"Turkey’s Finance Ministry plans new rules requiring crypto platforms to collect source and purpose data, with limits on stablecoin transfers."
6/23/2025,"Roughly 240 companies now hold Bitcoin in their treasuries, nearly doubling from 124 just weeks ago. Combined, they control around 4% of the total BTC supply."
6/23/2025,"Metaplanet has added 1,111 BTC to its corporate treasury, bringing its total holdings to 11,111 BTC, just 398 BTC shy of Tesla’s stash."
6/23/2025,Bitcoin price strength gradually returns after multiweek lows as risk assets show overwhelming confidence that a long war in the Middle East will not happen.
6/23/2025,"Honeypot scams lure crypto investors into buying tokens they can’t sell, locking their funds through smart contract tricks."
6/23/2025,"Bitcoin ASIC maker Canaan has launched pilot production in the US and dropped its AI chip business, signaling a strategic pivot to core crypto operations."
6/23/2025,"Long-term Bitcoin holders now control a record 14.53 million BTC, tightening supply as institutional demand rises despite geopolitical tensions."
6/23/2025,Trezor warned of ongoing phishing attempts exploiting its support contact form.
6/23/2025,"The savvy Bitcoin investor made a 496-fold return on his initial $60,000 investment in 2013."
6/23/2025,"Bitcoin dipped below $100,000 for the first time in six weeks, prompting predictions that BTC price would fall further to $93,000, with a possible bottom of $74,000."
6/23/2025,"Crypto speculators may offset some of their altcoin losses by investing in Bitcoin or BTC treasury firms, according to Hashcash inventor Adam Back."
6/23/2025,"Bitcoin bounced to $106,000 as traders bet on higher chances of Fed interest rate cuts due to tensions in the Middle East."
6/23/2025,ETP sentiment cooled in the latter half of last week amid reports of US involvement in the Iran conflict.
6/23/2025,Whales are betting hundreds of millions on Ether’s price recovery despite the industry’s most successful traders being net short amid escalating conflict in the Middle East.
6/23/2025,"Bitcoin is about to juggle a slew of geopolitcal and macroeconomic volatility triggers in a nail-biting end to June as $100,000 support hangs in the balance."
6/23/2025,OKX’s reported US IPO comes as the exchange faces regulatory pressures in Asia.
6/23/2025,FTX lawyers argued that creditors should not serve as a “backstop” for Three Arrows Capital’s risky leveraged strategy.
6/23/2025,"Grant Cardone’s real estate investment firm has bought 1,000 Bitcoin as part of its new treasury strategy combining real estate and crypto."
6/23/2025,"Michael Saylor’s Strategy bought another 245 Bitcoin last week after doubling down on his long-term BTC price prediction, forecasting BTC to hit $21 million in 21 years."
6/23/2025,Bitcoin has lost more than 8% over the past week as geopolitical tensions and military action between Israel and Iran ramped up.
6/23/2025,"Trump Media’s recently announced $400-million buyback plan will not alter its strategy of using $2.3 billion to invest in Bitcoin, according to the company."
6/23/2025,"Bitcoin bulls proved they are ready to buy dips to $100,000 and below. Which altcoins will follow?"
6/23/2025,Strategy chair Michael Saylor cryptically hinted at another Bitcoin buy as the company faces a lawsuit over its $5.9 billion loss on Bitcoin in Q1.
6/22/2025,"French lawmaker Sarah Knafo has invited Samson Mow to visit France, and Mow says he is keen to kick off a wave of nation-state Bitcoin adoption across Europe."
6/22/2025,"Texas becomes the first US state to commit public funds to a standalone Bitcoin reserve, aiming to treat BTC as a long-term strategic asset."
6/22/2025,"Adam Back says that since Strategy typically takes 16 to 18 months to double its Bitcoin per share, the premium on its stock is not ""unreasonable.”"
6/22/2025,"A Florida man says a Denver-based crypto trading school and a fake exchange tricked him into handing over $860,000 through phony trade signals."
6/22/2025,"Bitcoin’s drop below the $100,000 support pulled ETH, XRP, SOL and HYPE lower, but a relief rally may be around the corner."
6/22/2025,"BTC price declines accelerate as the US hits Iran's nuclear facilities, but traders are hopeful that Bitcoin may even gain from geopolitical uncertainty."
6/22/2025,MiCA’s licensing clarity helped Europe capture crypto flows as US retail activity declined despite a crypto-friendly Trump administration.
6/21/2025,"A new OMFIF blog warns the UK is losing its early advantage in digital asset regulation, as the EU enforces MiCA and the US advances with the Genius Act."
6/21/2025,"Michael Saylor has doubled down on his Bitcoin price prediction, citing massive geopolitical and regulatory changes."
6/21/2025,"Bitcoin’s AVIV ratio and power law model point to a $330,000 cycle top for BTC price."
6/21/2025,"A massive surge in Bitcoin Knots nodes hints at a brewing civil war in Bitcoin. If tensions escalate, the price could be the first casualty."
6/21/2025,"Eric Semler says he enjoys being a “lone voice in the wilderness” on Bitcoin, as most hedge fund executives still see it as a “fly-by-night concept.”"
6/21/2025,Real Vision CEO Raoul Pal says macroeconomic data suggests the current crypto cycle could extend into Q2 2026.
6/21/2025,"Bitcoin derivatives traders turned cautious, despite steady inflows to the spot BTC ETFs."
6/21/2025,"Nakamoto Holdings, led by Trump’s crypto adviser David Bailey, raises $51.5M in fresh capital to accelerate its Bitcoin acquisition strategy."
6/21/2025,"According to a post on CoinMarketCap's X account, the malicious code has been removed, though the team insists the investigation into the incident is still ongoing."
6/20/2025,The Federal Reserve may be forced to cut rates in the near future if the US goes to war with Iran or the trade talks collapse.
6/20/2025,"Bitcoin’s sell-off is accelerating, and most altcoins are following BTC’s path. Will traders buy the dips?"
6/20/2025,"Bitcoin may hold above $100,000 throughout summer, but seasonal trading data suggests minimal upside in Q3."
6/20/2025,"Over 28% of Ether’s supply is now locked, signaling tightening liquidity conditions, as more Nasdaq-listed companies establish corporate crypto reserves."
6/20/2025,"Bitcoin sees a giant leveraged long liquidate late shorts, but is it enough to spark the BTC price range exit that traders have wanted?"
6/20/2025,A temporary ban could be imposed as early as autumn based on an investigation into crypto miners’ energy consumption.
6/20/2025,"Bitcoin’s $96 billion in derivatives open interest fuels BTC price momentum near all-time highs, but rising leverage use raises the risk of liquidations and market volatility."
6/20/2025,Bitcoin’s open interest divergence and a cleansing of latecomer longs could set BTC price on track toward fresh all-time highs.
6/20/2025,Bitcoin bulls attempt to reclaim daily moving averages while volatility warnings come before a unique options expiry event for TradFi markets.
6/20/2025,BlackRock’s ETF is nearing the $70 billion mark as Bitcoin transactions continue to be dominated by large investors.
6/20/2025,Blockchain sleuths ZachXBT and Taylor Monahan say crypto scammers have been emboldened with US regulators dropping crypto-related court cases and politicians endorsing memecoins.
6/20/2025,"The Arizona Senate has voted to revive House Bill 2324, a Bitcoin reserve bill that initially failed in the House."
6/20/2025,"A recent poll on X shows that half of the respondents bet that Bitcoin would rise to $114,000, while the other half expect it to fall well below $100,000."
6/20/2025,"Santiment’s social media analysis found 1 bullish comment for every 1 bearish comment, which hasn’t happened since Donald Trump’s tariffs tanked markets in April."
6/20/2025,"Health tech firm Semler Scientific wants to boost its Bitcoin holdings from 3,800 BTC to 105,000 BTC by 2027 and has appointed a new director to lead the plan."
6/20/2025,"Parataxis will launch a Bitcoin-native treasury platform in South Korea via Bridge Bio, aiming to expand institutional access to BTC despite regulatory barriers."
6/20/2025,Pictures show a Texas sheriff’s department taking a power-cutting tool to a crypto ATM after a family reportedly used it to pay a scammer.
