Date,Text
12/26/2025,"Tether CEO Paolo Ardoino warned an AI sector correction could spill over into crypto markets in 2026, with some analysts projecting BTC to drop to as low as $65,000."
12/26/2025,"Headlines move crypto fast, but liquidity decides what lasts. Data from ETFs, stablecoins and onchain flows shows what really drives prices."
12/26/2025,"Need to know what happened in crypto today? Here is the latest news on daily trends and events impacting Bitcoin price, blockchain, DeFi, NFTs, Web3 and crypto regulation."
12/26/2025,Bitcoin simmered below resistance but teased a bullish breakout as the Asia trading session accompanied new all-time highs for gold and silver.
12/26/2025,"Bitcoiners wanting to focus on short-term factors should be “fairly methodical and mathematical,” says Strategy CEO Phong Le."
12/25/2025,Bitcoin ETF performance remained negative on Christmas Eve as a short final US trading session produced another $175 million in net outflows.
12/25/2025,"Crypto hackers took social engineering to a whole other level this year, and advances in artificial intelligence mean scams are about to get even harder to detect."
12/25/2025,"Elon Musk added that “triple-digit” economic growth could even be possible by 2030; however, some Bitcoiners worry about a 2026 bear market."
12/25/2025,"BTC may fall to $70,000 and ETH to $2,400 if the Fed pauses rate cuts in the first quarter of 2026 and inflationary pressure persists."
12/24/2025,"The Ontario Securities Commission has cleared Matador to raise $58 million, which it intends to use to expand its Bitcoin treasury."
12/24/2025,"Bitcoin’s selling pressure may be easing as momentum stabilizes, miners capitulate and liquidity conditions turn supportive."
12/24/2025,"Bitcoin and several major altcoins turned down from their overhead resistance levels, signaling that the bears continued to sell on rallies."
12/24/2025,"Bitcoin price predictions include an initial $100,000 target after completion of the Boxing Day options expiry, worth a record $23.7 billion."
12/24/2025,Bitcoin options markets remain tilted toward bears despite US investors’ expectations of economic stimulus injections and semi-bullish outlook for 2026.
12/24/2025,"Bitcoin and Ether ETFs have recorded sustained outflows since early November, which Glassnode says signals institutional disengagement."
12/24/2025,"Galaxy’s Alex Thorn says Bitcoin's $126,000 peak translates to $99,848 after being adjusted for inflation, falling short of its milestone six-figure mark."
12/24/2025,"Bitcoin has been a “monster in financial markets” even though it hasn’t hit the most optimistic 2025 price targets, says Anthony Pompliano."
12/24/2025,"Bitcoin holds near $87,000 as on-chain activity and exchange inflows fall, signalling tight liquidity and looming volatility."
12/23/2025,"Bitcoin printed bullish signals against gold and the dollar while staying below $90,000 as a whale opened multimillion-dollar crypto shorts."
12/23/2025,"Bitcoin has often surged after sustained hashrate drops, a trend that would provide much-needed relief to many struggling Bitcoin miners at current prices."
12/23/2025,"BlackRock’s IBIT Bitcoin ETF has featured on the $13.5 trillion asset manager's homepage, representing one of three major investment themes as the market heads into 2026."
12/23/2025,ZOOZ’s minimum bid‑price notice makes it the latest Bitcoin treasury stock to brush up against Nasdaq’s listing rules.
12/23/2025,"Bitcoin perpetual open interest climbed to 310,000 BTC while funding rates doubled, signaling bullish positioning for the year-end."
12/23/2025,The site acquisition gives Bitcoin miner Cipher a foothold in the largest US wholesale power market as miners broaden their infrastructure strategies.
12/23/2025,"Charts suggest the bulls will try to defend the support levels in ETH, BNB, XRP, SOL and DOGE, but higher levels are likely to attract sellers."
12/23/2025,"The project recently received approval to raise private, tax-deductible funding under Brazil’s cultural incentive laws, with a live performance planned in the federal capital."
12/22/2025,"Bitcoin approached $90,000 amid Santa rally speculation, backed by bullish derivatives and chart patterns that target a BTC price above $100,000."
12/22/2025,"Japan’s largest corporate Bitcoin holder approved preferred shares with dividends, signaling a shift toward income-focused institutional capital."
12/22/2025,Bitcoin saw new warnings of a BTC price breakdown as gold and silver hit new all-time highs in the shadow of Japanese market instability.
12/22/2025,Ghana legalizes cryptocurrency and gives its central bank authority to regulate and license providers to reduce fraud and systemic risks.
12/22/2025,"Crypto funds broke three weeks of net positive flows, after US investor sentiment took a hit following delays to the long-awaited CLARITY Act, set to reach the Senate in January 2026."
12/22/2025,"Bitcoin and select altcoins are attempting to start a recovery, but higher levels are expected to attract strong selling by the bears."
12/22/2025,"Fed policy shifts and crypto-friendly regulation point to a bullish 2026, but AI risk, ETF flows and consumer stress could test demand."
12/21/2025,"Brazil’s crypto market showed signs of maturity in 2025, with higher transaction volumes, larger per-user investments and growing demand for low-risk products."
12/21/2025,"Industry supporters said crypto ""would not be where it is today"" without US Senator Cynthia Lummis, who announced she would not seek reelection next year."
12/21/2025,"Social media sentiment indicates Bitcoin is in a range where a drop below $75,000 is possible, according to Santiment founder Maksim Balashevich."
12/21/2025,"Bitcoin price expectations diverged into the weekly close as $150,000 targets met calls for a drop to levels not seen in over a year."
12/21/2025,"Bitcoin is a decentralized software protocol that has a collective action problem, unlike centralized companies, according to Jameson Lopp."
12/20/2025,"Bitcoin continued to sell near $90,000 as investors reacted to weak US jobs data and slowing economic growth by shifting into safer assets."
12/20/2025,"Multiple factors, including ETF outflows, contracting demand, and price falling below key support levels, indicate the start of a BTC bear market."
12/20/2025,"Bitcoin's fundamental properties make it a better long-term bet than gold, according to Bitcoin maximalist and analyst Matthew Kratter."
12/20/2025,Bitcoin reached significant multiyear support versus gold as commentary diverged over a breakdown and the start of a new bear market.
12/20/2025,"A circulating report attributed to Fundstrat warns of a potential crypto drawdown in early 2026, setting downside targets for Bitcoin, Ether and Solana."
12/20/2025,Blockstream CEO Adam Back said that Castle Island Ventures founding partner Nic Carter is “not helping” the ongoing quantum-Bitcoin narrative for Bitcoiners.
12/20/2025,"As market participants continue to speculate on when altcoin season will arrive, BitMEX co-founder Arthur Hayes argued there is “always an altcoin season happening.”"
12/20/2025,"BlackRock’s spot Bitcoin ETF ranked sixth in 2025 ETF inflows despite posting a negative annual return, a signal analysts say reflects long-term conviction."
12/19/2025,"Fidelity’s director of macro is predicting a Bitcoin bottom near $65,000 in 2026, but remains a “secular bull” despite predicting an end to the current four-year cycle."
12/19/2025,"Bitcoin's onchain data reveals new BTC whales with 50% of the realized capital, highlighting a shift in how capital is shaping the market."
12/19/2025,"Veteran trader Peter Brandt said that the US Clarity Act will be a positive for the industry, but probably won’t “redefine” Bitcoin’s price."
12/19/2025,"In its annual predictions report, Galaxy’s analysts said onchain dollar transfers may process more volume next year than the US bank system that handles payroll and bill payments."
12/19/2025,"Bitcoin and several major altcoins are attempting to start a recovery, but negative investor sentiment and selling at range highs are preventing a stronger bull trend from forming."
12/19/2025,"Bitcoin advocates have been divided over Saylor’s updated BTC thesis, leaving question marks over how the Strategy exec views the cryptocurrency."
12/19/2025,"Coinbase Institutional says clearer regulation, stablecoin growth and shifting macro conditions could mark a turning point for crypto markets in 2026."
12/19/2025,The BitMEX co-founder's latest Substack essay argues the US Fed’s liquidity program mirrors quantitative easing mechanics that favor Bitcoin and other scarce assets.
12/19/2025,Bitcoin’s 36% drawdown from its all-time highs resulted in the relative strength index flashing a potential bottom signal not seen since early 2023.
12/19/2025,"Metaplanet will debut US trading via American Depositary Receipts, aiming to broaden access for US investors without raising new capital."
12/19/2025,"Altcoin blockchains are preparing for long-term quantum risk, while influential Bitcoin voices disagree over how and when it should be addressed."
12/19/2025,Bitcoin headed higher despite the Bank of Japan's interest-rate hike while reactions saw bullish risk-asset signals and no further policy tightening.
12/19/2025,"The total crypto market cap fell to $2.93 trillion, its lowest since April, erasing yearly gains as analysts anticipated further declines."
12/19/2025,"In a lawsuit, the SEC says some hosted Bitcoin mining services could trigger US securities laws, but an industry executive says most providers have nothing to worry about."
12/19/2025,"Crypto has tracked lower late this year despite pro-regulation shifts, ETF launches, and institutional buying, prompting analysts to question structural issues."
12/19/2025,"Cypherpunk Adam Back dismissed concerns that quantum computing poses a threat to Bitcoin, arguing the technology is still “ridiculously early.”"
12/18/2025,"Bitcoin tagged $89,500 as US CPI data revealed sudden multiyear lows in inflation, but liquidations stayed high as the BTC price spiked."
12/18/2025,"Bitcoin briefly clinched $90,000 after the November Consumer Price Index report showed a drop in US inflation, but the essential components for an extended rally remain elusive."
12/18/2025,"Data suggests that fears about Xinjiang-related Bitcoin mining have overstated the impact, with hashrate losses proving brief and driven partly by US power curtailments."
12/18/2025,"US lawmakers are only considering de minimis tax exemptions for dollar-pegged stablecoins, according to Bitcoin Policy advocate Conner Brown."
12/18/2025,"Tether CEO Paolo Ardoino says an AI-driven bubble could shake Bitcoin, and shares his outlook on Europe, DATs and tokenization in 2026."
12/18/2025,"Coinbase expands in Poland with PPro to support Blik, making crypto transactions faster and easier amid stalled local regulations."
12/18/2025,Spot Bitcoin ETFs logged their strongest inflows in over a month amid renewed institutional demand tied to shifting macro expectations.
12/18/2025,Analysts estimated that crypto treasury firms face up to $11.6 billion in outflows if MSCI excluded them from its indexes.
12/18/2025,"Bitwise predicted Bitcoin's volatility will stay below Nvidia's in 2026, citing institutional adoption and ETFs as drivers of the asset’s maturation."
12/18/2025,"Bitcoin’s Taproot usage is declining, signaling wider concerns around its quantum future, as the leading cryptographers race to solve the quantum threat in 2026."
12/17/2025,"Bitcoin buying power from institutions flipped the daily mined BTC supply for the first time since the start of November, new data showed."
12/17/2025,"A whale moved 4,000 Bitcoin to Binance, sparking fresh fears of a deeper BTC price drop if the $81,500 support level is lost."
12/17/2025,"The number of crypto exchange-traded products is going to “accelerate forward at ridiculous speed” in 2026, according to Bitwise researcher Ryan Rasmussen."
12/17/2025,"While it may be possible for a public company to catch up to Michael Saylor’s Strategy Bitcoin holdings, it is probably unlikely, Bitcoin entrepreneur Anthony Pompliano says."
12/17/2025,"It’s estimated that Bhutan has around 11,286 Bitcoin in total, a stash worth over $986 million, making it the fifth-largest known holder among countries."
12/17/2025,Quantitative Bitcoin and digital asset fund Capriole says the price of Bitcoin could plummet if the network doesn’t develop resistance to quantum computing.
12/17/2025,"Lightning Network’s capacity reached an all-time high as exchanges increased adoption, while a new Taproot Assets update has enabled multi-asset transactions."
12/17/2025,"A new report warned that the Central African Republic’s crypto push favored elites and exposed the country to foreign criminal networks, rather than boosting financial inclusion."
12/17/2025,"Bitcoin took out liquidity at the Wall Street open as a move above $90,000 was followed by a snap retracement, liquidating late long and short entries."
12/17/2025,"Bitcoin and altcoin rallies are being capped by heavy selling near the intraday range highs, leading some analysts to revise their end-of-year price estimates. What do technical charts say?"
12/17/2025,"The likelihood of a Bitcoin correction to $70,000 has increased, but one analyst said the price drop would confirm a macroeconomic reset, rather than the start of a new bear market."
12/17/2025,The 15-year agreement anchors Hut 8’s shift toward long-duration AI infrastructure revenue as hyperscalers seek power-first compute capacity.
12/17/2025,"Bitcoin ETFs, corporate treasuries and macro tailwinds are challenging BTC’s traditional four-year cycle, which could result in new all-time highs in 2026."
12/16/2025,"Bitcoin liquidity grabs continued at the Wall Street open, with traders hoping that a breakthrough of resistance would propel the BTC price toward the $100,000 zone."
12/16/2025,"Bitcoin price held above $85,000, but weakening spot ETF flows and year-end volatility tested near-term bullish sentiment."
12/16/2025,The company has 180 days to regain compliance with Nasdaq’s minimum bid price requirement after its shares traded below $1 for 30 consecutive business days.
12/16/2025,"Gold strongly outperformed Bitcoin in 2025, resulting in a 50% decline in the BTC-to-gold ratio. Will the trend flip in BTC’s favor in 2026?"
12/16/2025,"The amount of Bitcoin in long-term holder wallets hit cyclical lows, but is it enough to help the bulls avoid a decline toward $68,000?"
12/16/2025,"Bitcoin fell 26% in three months but outperformed most crypto sectors as Ether dropped 36%, AI tokens fell 48%, and memecoins dipped 56%."
12/16/2025,"Users can now buy, swap, send, and receive Bitcoin directly within the popular Ethereum-focused wallet, expanding its multichain reach."
12/16/2025,"Crypto markets slid as traders turned risk-averse amid renewed Fed leadership speculation, tightening liquidity and broader macro uncertainty."
12/16/2025,"Past record spikes in Bitcoin accumulation preceded major rallies, including a 900% surge in 2012 and a 350% rise in 2011."
12/16/2025,Grayscale’s 2026 outlook cites institutional demand and clearer US regulation as key catalysts for Bitcoin’s surge in the first half of 2026.
12/15/2025,"Data shows traders bought the Bitcoin price dip, but $2.78 billion in selling by larger entities overshadowed the bulls. Can BTC hold above $86,000?"
12/15/2025,"Bitcoin rallies continue to be capped by selling near the intra-day range highs, and the expectation of a Bank of Japan interest rate hike could amplify the downturn in BTC and altcoins."
12/15/2025,"The Bitcoin parabola broke, leading some analysts to predict an 80% drawdown in BTC price. Will growing demand from traditional finance and strategic crypto reserves nullify all bearish predictions?"
12/15/2025,"Bitcoin and Ether accounted for the largest allocations, while short-Bitcoin products posted net outflows, according to CoinShares data."
12/15/2025,"Corporate Bitcoin buying continued as American Bitcoin surpassed ProCap, even as proxy stocks declined and volatility gripped the crypto market."
12/15/2025,"Bitcoin fell below $87,000 as Wall Street selling contrasted with Strategy’s announcement of a 10,000+ BTC buy over the past week."
12/15/2025,"Bitcoin Bancorp will join Bitcoin Depot, CoinFlip, and others offering crypto ATMs to the Lone Star State, which has begun gaining Bitcoin exposure via ETFs"
12/15/2025,"Michael Saylor’s company increased its Bitcoin holdings to 671,268 BTC following back-to-back weeks of purchases exceeding 10,000 BTC."
12/15/2025,"Former Canaan co-chair Jianping Kong asserted that Bitcoin’s 10% hashrate fall in one day was caused by about 400,000 mining rigs shutting down in China’s Xinjiang region."
12/15/2025,"Bhutan signs an MoU with Cumberland DRW to support Bitcoin reserve management and explore stablecoins, mining and AI compute in Gelephu Mindfulness City."
12/15/2025,"An investor willingly sent his hard-earned Bitcoin retirement fund to a scammer, losing his entire stash after falling for a pig butchering scam despite repeated warnings."
12/15/2025,Bitcoin faced a new battle for support within a stubborn range and a busy week of macro data before the Christmas holiday period.
12/15/2025,"Global macro analyst Luke Gromen is dialing back his Bitcoin enthusiasm, warning that the top crypto looks vulnerable as macro conditions, quantum‑risk narratives and technicals shift."
12/15/2025,"Bitcoin fell to $87,600 amid more Sunday selling pressure, while Michael Saylor hinted that Strategy would buy more."
12/14/2025,"10x Research’s Markus Thielen says Bitcoin’s four-year cycle still exists but is now driven by politics, liquidity and elections rather than the halving."
12/14/2025,"The Bitcoin community continues to debate the philosophical and market implications of a quantum computer hacking old, vulnerable addresses."
12/14/2025,"The Bank of Japan is expected to increase its benchmark interest rates on Friday, a historically bearish signal for riskier assets like Bitcoin."
12/14/2025,"Bitcoin traders braced for a major move “around the corner” after days of BTC price action sticking to a tight range around $90,000."
12/13/2025,Brazil’s largest private bank says Bitcoin can improve portfolio diversification and hedge currency risk despite a volatile year for the asset.
12/13/2025,Bitfinex said the recent 66% slide in spot trading volumes echoes lulls seen before next leg in the cycle.
12/13/2025,Strategy remains in the Nasdaq 100 as MSCI considers excluding firms whose crypto holdings exceed 50% of total assets.
12/13/2025,"The guide was a good-faith primer on crypto custody basics and best practices, including different forms of wallet storage and common risks."
12/13/2025,"Despite traditional ETF investors willing to pay premiums to go long, Bitcoin natives selling covered calls have put a damper on a price rally."
12/12/2025,The gap between equities and Bitcoin got wider after Bitcoin’s post-all-time-peak correction in October.
12/12/2025,"Bitcoin mining’s hash price, a critical metric for determining profit margins in the industry, is hovering near record lows."
12/12/2025,Short-term Bitcoin traders were profitable for 229 days this year despite the recent 30% correction in BTC price. Will this trend carry over into 2026?
12/12/2025,"Bitcoin and several major altcoins have turned down from their respective overhead resistance levels, indicating that the bears are still very active at the range highs."
12/12/2025,Relaxing the current rules for traditional retirement funds and pension plans could attract trillions of dollars of capital flows into crypto.
12/12/2025,The comments followed the asset management company’s policy change allowing its clients to trade crypto exchange-traded funds.
12/12/2025,"Abu Dhabi is anchoring Bitcoin for institutions, while Dubai builds payments, stablecoins and Web3 use cases into daily commerce."
12/12/2025,"Crypto markets rebounded after the Fed’s third rate cut this year, with analysts predicting a larger bounce following the typical post-cut pattern."
12/12/2025,"Bitcoin miners Marathon Digital Holdings, Riot Platforms and Hut 8 are already in the top ten largest public companies holding Bitcoin."
12/12/2025,Bitcoin faced troublesome resistance levels to end the Wall Street trading week as new bullish BTC price forecasts reappeared.
12/12/2025,"Bitcoin price targets included $76,000 and $50,000, thanks to growing bearish BTC price divergences and a lack of upward price momentum."
12/11/2025,Markus Thielen warns Bitcoin’s institutional rally could reverse as ETF outflows and market fatigue weigh on risk appetite.
12/11/2025,"Bitcoin bulls tried to spark a recovery, but were met with heavy selling pressure near $107,000. A similar fate awaited most altcoins, which sold off from their respective resistance levels."
12/11/2025,Bitcoin’s momentum loss continues as long-term holders add to market selling pressure and rising US dollar strength leads investors to reduce their exposure to risk.
12/11/2025,"Data shows that BTC’s “average annual returns have gradually declined, with no peaks at all in the last cycle, confirming the hypothesis that Bitcoin's risk/return structure has changed.”"
12/11/2025,"IBM targets quantum advantage by 2026 and fault-tolerant systems by 2029 with new processors and faster error correction, advancing the race toward quantum computing."
12/11/2025,"The biggest Bitcoin ATM operator in North America is expanding to Hong Kong, citing growing global demand for cash-to-crypto access."
12/11/2025,"The incident at the Massillon, Ohio, facility followed the company's Q3 earnings report on Monday, showing a net loss of over $266 million."
12/11/2025,"Michael Saylor’s company remains the top Bitcoin holder, but its dominance has fallen amid slower accumulation and rising competition."
12/11/2025,"Increasing stablecoin supply mirrors past liquidity patterns that preceded significant Bitcoin rallies. Will BTC price return to $124,000 soon?"
12/11/2025,"The end of Trump's last US government shutdown back in 2019 saw a boom in crypto markets, but things are a bit different this time around."
12/11/2025,"Bitcoin maintained its November pattern of higher lows as it rebounded to $105,000, but traders remained cautious about a potential rejection at key resistance."
12/11/2025,"Smart money traders have also added $8.5 million worth of net long Bitcoin positions, signaling growing optimism among the industry’s most successful traders."
12/11/2025,"Morgan Stanley’s Denny Galindo likens Bitcoin’s cycle to the seasons, warning that the market’s “fall” phase is a time to secure gains before a downturn."
12/11/2025,SoFi CEO Anthony Noto says the bank also plans to introduce a stablecoin called SoFi USD and views blockchain and crypto as a “super cycle technology.”
12/11/2025,"Bitcoin fell to weekly lows at $101,300 as US equities and gold rallied ahead of the key vote to end the US government shutdown, signaling a shift in investor sentiment to traditional assets."
12/11/2025,"Bitfinex says macro conditions signal consolidation, but others are optimistic that Bitcoin will gain as usual in November."
12/10/2025,"Tensions between the two countries appear to have cooled off on Sunday, as representatives from both sides signaled a willingness to negotiate."
12/10/2025,"The US-China talks will “be central” to crypto traders’ market moves in the short-term, sentiment platform Santiment said."
12/10/2025,"BTC price action stabilized at around $112,000 ahead of fresh volatility into the weekly close and Bitcoin futures market open."
12/10/2025,"The crypto market plunge on Friday was partly due to crypto traders reaching an “all-time impatience” with the market, says crypto trader Alex Becker."
12/10/2025,"Bitcoin is retesting the golden cross, a bullish pattern that preceded past parabolic rallies, with analysts saying a breakout above $110,000 could trigger another move."
12/9/2025,"Bitcoin is a “buy” again for some investor cohorts, with sharks standing out after a week-long BTC buying spree, CryptoQuant reports."
12/9/2025,"UK Bitcoin treasury firm Smarter Web may look to acquire competitors at a discount, with CEO Andrew Webley eyeing FTSE 100 status despite a stock price decline."
12/9/2025,"The scam is designed to look like a Blockstream Jade hardware wallet firmware update, and links to a malicious site."
12/9/2025,"Bitcoin miners’ current rate of accumulation mirrors a pattern that fueled a 48% rally in 2023, but macroeconomic risks could cap BTC’s gains."
12/9/2025,"Solid inflows into spot Bitcoin ETFs signal sustained demand from the bulls, increasing the likelihood of a break above the $117,500 resistance. Will altcoins follow?"
12/9/2025,"Spot Ether ETFs recorded over $230 million in net inflows as of Thursday, recovering from last week’s net outflows of nearly $800 million."
12/9/2025,"Crypto treasury firms will need to do more than copy Strategy’s playbook to thrive as the market matures, and that competition could boost crypto markets."
12/9/2025,"Galaxy CEO Mike Novogratz says Bitcoin could surge again as the US Federal Reserve restarts its cutting cycle, with momentum also coming from regulatory reform."
12/9/2025,"Despite a marginal recovery in the price of Bitcoin, the majority of bull market indicators for Bitcoin have now turned red, suggesting “momentum is clearly cooling.”"
12/9/2025,"Africa has its first Bitcoin treasury company, but its utility goes far deeper than publicly-listed stocks tied to BTC holdings on a balance sheet."
