Date,Text
4/11/2025,"Bitcoin’s fall below $106,000 sent crypto sentiment into “Extreme Fear,” with the Fear & Greed Index plunging to its lowest level in nearly seven months."
4/11/2025,"Stablecoins, tokenized money market funds and tokenized treasuries could become a common treasury asset in the future, Fireblocks’ John Hallahan told Cointelegraph."
4/11/2025,"Bitcoin gave up $104,000 for the first time in weeks, while traders warned of a return to sub-$100,000 levels and new buyers amassed unrealized losses."
4/11/2025,"HyperUnit, the whale that made $200 million from the US-China tariff crash last month, is now betting on a rebound in Bitcoin and Ether, opening $55 million in long positions."
4/11/2025,"Over $1.3 billion was wiped out across the crypto market as traders shifted their focus to $100,000 as the last line of defense for Bitcoin."
4/11/2025,"Analysts say Bitcoin is trading at a steep discount to its macro backdrop, with resilient ETF demand and rising stablecoin liquidity hinting at a possible rebound."
4/11/2025,"The Chinese budget AI model QWEN3 was the only one to generate positive returns, while its more heavily funded competitors returned significant losses."
4/11/2025,"Bitcoin price fell to four-month lows below $100,000 as sellers overwhelmed buyers, and analysts speculated that “dead bodies” from the Oct. 10 sell-off are beginning to surface."
4/11/2025,"In early October, Tom Lee and Arthur Hayes were confident that Bitcoin could still reach $250,000 by year-end, but analysts say half that figure is now unlikely."
4/11/2025,The companies saw profits and Bitcoin reserves increase in the third quarter of 2025 as they moved further into high-performance computing and energy development.
4/11/2025,Sequans shares fell 16% on Tuesday after the chip maker said it sold 970 Bitcoin to redeem half of its $189 million outstanding convertible debt.
4/10/2025,"The Bitcoin four-year cycle is driven more by ""human emotion"" and will likely continue to play out in “some form,” according to a crypto executive."
4/10/2025,"Crypto exchange Coinbase is pursuing a National Trust Company Charter in the US, but said it has ""no intention of becoming a bank."""
4/10/2025,"Bitcoin ETFs are the market’s “clearest sentiment barometer,” indicating an incoming breakout for “Uptober,” analysts told Cointelegraph."
4/10/2025,"Bitcoin rallied close to $124,000 as surging US demand for BTC, shifting Federal Reserve monetary policy and hopes for a bullish Q4 lifted investor sentiment."
4/10/2025,"Many major banks anticipate that Bitcoin will rise to as high as $200,000 by year-end, driven by record ETF inflows and capital rotation from gold markets."
4/10/2025,"The $300 billion record stablecoin supply may act as “rocket fuel” for the crypto market, while signaling a growing integration with global finance, industry watchers told Cointelegraph."
4/10/2025,Asset manager VanEck attributed the broad decline in blockchain network revenue in September to lower volatility in the crypto markets.
4/9/2025,"Bitcoin shows signs of exhaustion with the recent drop to $107,000, but a break above $112,000 might confirm last week’s lows as the BTC price bottom."
4/9/2025,The Eric and Donald Trump Jr.-backed American Bitcoin finished trading at a gain on Wednesday after a turbulent first day on the Nasdaq.
4/9/2025,"Binance’s Bitcoin to stablecoin ratio just passed a level that previously marked critical market shifts in the crypto market structure. Is the bottom in, or is a new bear market beginning?"
4/9/2025,"Bitcoin shrugs off US jobs data and its latest attempt to crack $112,000 resistance in a limp Wall Street open."
4/9/2025,"Bitcoin price faces pressure as investors shift to bonds and gold, and risk aversion raises the chance of BTC falling to $108,000."
4/9/2025,"Regulations, hype cycles and pie-in-the-sky promises have scuppered blockchain city projects across the globe... but one has succeeded."
4/9/2025,"Bitcoin financial services firm River says private businesses have accumulated 84,000 Bitcoin in 2025 amid a year of regulatory clarity and a strong bull market."
4/9/2025,"Bitcoin may start a bear market next month if four-year BTC price cycles are still valid, and hit bottom a year later at $50,000."
4/9/2025,"From Cyprus to Afghanistan, crypto has shown its value in times of crisis. Now, with Washington rewriting the rules, the industry faces its most decisive moment."
4/9/2025,"Australia's tax office reports self-managed retirement funds have 4% less crypto than last year, but one crypto executive says the number is likely ""undercooked."""
4/9/2025,"The SEC’s Crypto Assets Task Force is reviewing a roadmap to protect Bitcoin, Ether and other digital assets from future quantum computing threats."
4/8/2025,"A Power of 3 pattern suggests a $126,000 target for Bitcoin after a leverage reset, but BTC price must first flip its immediate resistance level into new support."
4/8/2025,"Bitcoin is trying to start a recovery from $112,000, but bears may pose a substantial challenge at $117,000 and then at $120,000."
4/8/2025,"Metaplanet scooped up 463 Bitcoin on Monday, making it the first public company to capitalize on the August Bitcoin dip."
4/8/2025,"Bitcoin tries to recover from its trip below $112,000 as BTC price volatility keeps the market in a state of flux."
4/8/2025,"The month of August has historically been a bearish one for Bitcoin, and is already off to a choppy start."
4/8/2025,"Hyperliquid’s rapid response may boost confidence in decentralized trading platforms, which are gaining market share."
4/8/2025,"Bitcoin ETF netflows may be key in gauging market appetite as exchange order-book liquidity puts $116,000 top of the list for bulls."
4/8/2025,Profit-taking broke a 15-week winning streak of global cryptocurrency ETPs last week after hawkish remarks that followed last week’s US Fed rate decision.
4/8/2025,Carving out clear jurisdictions for the SEC and CFTC may ease investor concerns over ambiguous securities laws.
4/8/2025,French political party Rassemblement National is reportedly preparing a draft law to mine Bitcoin with surplus nuclear energy.
4/7/2025,"Congress passed the Big Beautiful Bill, Trump’s budget proposal, which could benefit Bitcoin, analysts say."
4/7/2025,"Bitcoin miners strategically curtailed operations in June to avoid costly peak demand charges in Texas, sacrificing short-term production for lower costs."
4/7/2025,"Bitcoin whales awoke after 14 years of dormancy, having held their BTC since it was trading below $0.78 a coin in 2011."
4/7/2025,"Bitcoin price rally stalls at $110,000 after strong US employment data, with big overhead resistance at $112,000 and several key support levels below."
4/7/2025,"Onchain data shows that retail investors are not buying Bitcoin, but analysts say they’ve shifted into buying the spot ETFs."
4/7/2025,"After sentencing the three kidnappers to 12 years each and ordering civil damages, the court noted that the masterminds behind the attack remain at large."
4/7/2025,"A solo miner with just 2.3 petahashes successfully mined a Bitcoin block on Thursday, netting them $349,028 in rewards."
4/7/2025,"Crypto analyst Rekt Capital says that while there’s a lot of talk about the Bitcoin cycle extending into 2026, traders should not “throw away time-tested principles.”"
4/7/2025,"A crypto analyst suggests that a drop to $108,000 could mark the beginning of Bitcoin’s fall back below the six-figure price level."
4/7/2025,"Bitcoin is the subject of rumors as wallets holding 80,000 BTC suddenly reactivate after a 14-year hiatus."
4/7/2025,Increasing US regulatory clarity is enabling more traditional finance participants to seek out decentralized financial solutions.
4/7/2025,Bitcoin has historically posted double-digit gains in the weeks following the passage of major US debt-expanding bills. Will 2025 follow the same pattern?
4/7/2025,"Bitcoin sold off near the $110,000 ceiling, but the price reset could give BNB, SOL, LINK and AAVE a chance to rally."
4/7/2025,Bitcoin's pullback reflects the market’s anxiety about the US economy and dormant BTC wallets shifting billions worth of BTC.
4/6/2025,The Bitcoin supply held by whale entities has declined by 40% over the past eight years as profit-taking continues.
4/6/2025,"Hackers are moving from smart contract vulnerabilities to exploiting human behavioural weaknesses, according to the co-founder of Web3 cybersecurity firm CertiK."
4/6/2025,"Bitcoin’s liquid supply has fallen 30% in 18 months as institutional demand and new reserve strategies tighten the market, Sygnum Bank reports."
4/6/2025,"Bitcoin is witnessing a tough battle between the bulls and the bears at $105,000, but several altcoins are showing strength with potential breakout setups."
4/6/2025,"The California State Assembly passed a bill that would allow state agencies to accept crypto for payment in a unanimous 68-0 vote, which will now head to the Senate."
4/6/2025,"A Bitcoin ETF branded with Donald Trump’s social media platform, Truth Social, is seeking a green light from the Securities and Exchange Commission."
4/6/2025,"Bybit unveiled a major security overhaul following its $1.4 billion hack in February, with upgrades across audits, wallet protection and information security."
4/6/2025,Hong Kong reportedly plans to permit crypto derivatives for professional investors and expand its fintech ecosystem.
4/6/2025,"K Wave Media announced a $500 million securities deal to fund a Bitcoin-treasury strategy, aiming to become the “Metaplanet of Korea.”"
4/6/2025,President Lee Jae-myung rose from being a child laborer in post-war South Korea to becoming a crypto-friendly leader of one of the world’s largest digital asset markets.
4/6/2025,"The decentralized physical infrastructure network market could surge to $3.5 trillion by 2028 as AI and blockchain converge, according to a new World Economic Forum report."
4/6/2025,"Since the IBIT ETF futures are only available to accredited investors, the latest crypto developments in Russia left many retail players unimpressed."
4/6/2025,"Securities and Exchange Commission chair Paul Atkins told a Senate subcommittee that his approach to crypto “will be done through notice and comment rulemaking, not through regulation by enforcement.”"
4/6/2025,"Bitcoin traders set the stage for a volatile breakout with liquidity amassing above and below the spot price, and eyes are on the road to new all-time highs."
4/6/2025,"Corporate Bitcoin buyers should brace for impact or abandon their strategy if they are unprepared for an 80% BTC price drop, Saifedean Ammous said."
4/6/2025,"Bitcoin price eyes a breakout as a weakening dollar, US debt concerns, and gold limits shift investor focus."
4/6/2025,"At least 60 Bitcoin strategy adopters among publicly listed companies collectively doubled BTC holdings in the past two months, outstripping the buying speed of Michael Saylor’s Strategy."
4/6/2025,Pakistan’s crypto minister met with Trump’s digital asset leadership to promote cross-border cooperation and outline Bitcoin-powered infrastructure plans.
4/5/2025,OKX claims to have not received any requests from law enforcement to freeze funds after Tron’s X account was compromised.
4/5/2025,Bitcoin deals with nearby liquidity into the weekly close as traders turn to the key Fed meeting for BTC price clues over the coming week.
4/5/2025,"Arizona state senator and Bitcoin advocate Wendy Rogers said, “Bitcoin doesn’t need Arizona, Arizona needs Bitcoin."""
4/5/2025,Strategy co-founder Michael Saylor posted the Bitcoin chart signaling an impending Bitcoin purchase by the company the following day.
4/4/2025,Bitcoin adds gains as US stock markets drop a record $3.5 trillion in value and Federal Reserve Chair Jerome Powell warns of “higher inflation and slower growth.”
4/4/2025,Exchange-traded funds offering structured exposure to Bitcoin's performance are becoming popular among traditional investors.
4/4/2025,"Crypto firms take a hit as Trump’s new tariffs rattle markets, sinking stocks and stalling IPO ambitions across sectors."
4/4/2025,"Has Saylor pushed Strategy too far? With MSTR at the center of clashing leveraged ETFs and convertible stock plays, the market is making its own bets."
4/4/2025,Bitcoin and select altcoins hold steady even as the threat of a global trade war crushes the stock market.
4/4/2025,"CLS Global is one of the “victims” of the FBI’s trap token NexFundAI, alongside Hong Kong-linked ZM Quant Investment and Russia-linked Gotbit Consulting."
4/4/2025,"“It will take a decade for the US to catch up with cutting-edge chip manufacturing,” Braiins chief marketing officer Kristian Csepcsar said."
4/4/2025,The preliminary injunction blocking Bitcoin purchases is connected with a broader dispute surrounding a merger with Fatbrain AI that went sour in October last year.
4/4/2025,Real Vision's Jamie Coutts is watching June for a potential altcoin market recovery but says traders should treat network activity as the “north star” for crypto investing.
4/4/2025,"Arthur Hayes says that tariffs will correct “global imbalances,” which will positively impact Bitcoin's price over the medium term."
4/4/2025,Over $21 million in Bitcoin was unstaked from Babylon as early users claimed 600 million BABY tokens in the platform’s latest airdrop.
4/4/2025,"The growing BTCFi sector and potential interest rate cuts on the horizon may create more demand for Bitcoin as a productive, yield-bearing asset."
4/4/2025,"A Bitcoin sentiment metric fell to bear market lows this week, but clever counter-traders may interpret this as a risk-on, go-long opportunity for BTC."
4/4/2025,"Nansen analysts expect a 70% probability that crypto markets will find their bottom by June, as tariff negotiations are pressuring traditional markets worldwide."
4/4/2025,"In an exclusive interview, Hut 8 CEO Asher Genoot reveals how the Trump-backed American Bitcoin venture is aiming to dominate US mining and ultimately take its vision public."
4/4/2025,"Bitcoin could fall to its 2021 all-time high at $70,000 in less than two weeks, according to multiple BTC price forecasting models."
4/4/2025,"MiCA-licensed OKX has significantly improved compliance in the past 18 months, but the Maltese regulator said it could not ignore its past failures."
4/4/2025,"Bitcoin bulls aim to hold the $80,000 level to prevent BTC from following the record-breaking losses seen across US equities markets."
4/3/2025,"Even miners selling high-performance computing to AI models are under strain, according to JPMorgan analysts."
4/3/2025,"The US manufacturing PMI has entered expansion mode for two months in a row, setting the stage for a positive reversal in the business cycle."
4/3/2025,"El Salvador President Nayib Bukele says the country will keep buying at least one Bitcoin a day, despite pressure from the International Monetary Fund."
4/3/2025,Coinbase chief legal officer Paul Grewal says the firm will “do what it takes for as long as it takes” to get the information from the securities regulator.
4/3/2025,"The IMF has issued new requests under its $1.4 billion deal with El Salvador, aiming to restrict BTC purchases by the public sector."
4/3/2025,"A post-inauguration cooldown wasn’t unexpected, one analyst told Cointelegraph, but if Trump’s promises stall, “market sentiment will dampen further.”"
4/3/2025,"The Bybit hacker laundered the stolen funds in just 10 days, but security firms said some assets may still be recoverable through blockchain tracing."
4/3/2025,Gold leaves Bitcoin in the dust over US trade tariffs as BTC price action joins stocks and even the US dollar in taking a fresh hit.
4/3/2025,"Bitcoin price volatility continues, but BTC derivatives remain strong, signaling that whales expect a limited price decline."
4/3/2025,"The Albanese government has no plans to follow the lead of the Trump administration, which has announced plans to stockpile XRP, Solana, Cardano, Ether and Bitcoin."
4/3/2025,"Bybit CEO Ben Zhou confirmed that $280 million in stolen funds has gone dark, with $1.07 billion remaining trackable as investigators race to freeze assets."
4/3/2025,"Turkish banks have been increasingly moving into crypto by offering their clients investments in diverse crypto assets, with BankPozitif being the latest."
4/3/2025,"The start of US trade tariffs produces a fresh headache for Bitcoin bulls, with BTC price action increasingly aiming for a rematch with $78,000 lows."
4/2/2025,"Trade war concerns and traditional market volatility threaten a short-term BTC correction below $90,000, analysts told Cointelegraph."
4/2/2025,"Coinbase, the largest custodian for US-based spot Bitcoin ETFs, wants US state-chartered banks to be allowed to provide and outsource crypto custody and execution services."
4/2/2025,"Bitcoin’s sell-off might not be over yet, but does data point to the potential end of the BTC bull market?"
4/2/2025,"THORChain’s node operators approved a plan to convert $200 million in debt into equity tokens, but community members are raising concerns over its long-term viability."
4/2/2025,"Bitcoin fails to hold six figures as a fresh round of trade-war posturing begins, but market participants are confident that the worst is over."
4/2/2025,"The US commodities regulator is investigating Super Bowl markets offered by Crypto.com and reportedly Kalshi, asking them how they comply with derivatives rules."
4/2/2025,Both Canada and Mexico have agreed to implement policies to stop the flow of illegal drugs and immigration into the US after a phone call with US President Donald Trump.
4/2/2025,The platform will offer BTC and AVA rewards for cryptocurrency-based bookings on Trivago.
4/2/2025,"Block sizes have increased steadily since Bitcoin's Taproot upgrade, but they have more room to grow, according to Mempool Research."
4/2/2025,"Bitcoin bulls face an uphill struggle to stem selling amid worries that BTC price weakness will end up challenging levels around $90,000."
4/2/2025,"Bitcoin’s price rallied by 122% in 2024, yet its annualized volatility reached the lowest level on record."
4/1/2025,MicroStrategy may decide not to move forward with the perpetual preferred stock offering if market conditions aren't favorable this quarter.
4/1/2025,"The price of Bitcoin hit an all-time high of $108,000 on December 17, 2024, but has declined by more than 10% since that time."
4/1/2025,Bitcoin has a current market capitalization of roughly $1.9 trillion and surpassed silver's $1.6 trillion market cap in 2024.
4/1/2025,"A rise in ransomware, kidnappings and extortion shows the growing risks faced by crypto traders and investors as the sector expands."
4/1/2025,"Bitcoin is in a firmly different mood as the first Wall Street trading week ends, but BTC price action still needs to convince wary traders."
4/1/2025,"Bitcoin’s daily volume remains 91% lower than the $743 million on Dec. 5, when BTC first surpassed the $100,000 milestone."
3/31/2025,"Bitcoin whales scoop up BTC every time it slips to its price range lows, mirroring a bullish trend seen in 2020."
3/31/2025,Metaplanet issued 2 billion yen ($13.3 million) in zero-interest bonds to capitalize on Bitcoin’s recent price dip and increase its BTC holdings.
3/31/2025,"Bitcoin price slips below $82,000 as investor anxiety shows up in US stock futures markets. Will BTC close the month above $80,000?"
3/31/2025,"California Democrat Avelino Valencia has amended a money transmission bill to make Bitcoin and crypto rights a major focus, potentially benefitting the state’s 39.4 million residents."
3/31/2025,"Bitcoin price fails to find upward momentum, but multiple data points prove BTC currently trades at a discount."
3/31/2025,"Bitcoin miner MARA Holdings will offer up to $2 billion worth of its stock, the proceeds of which will partly be used to purchase more Bitcoin."
3/31/2025,"Bitcoin bulls showed up to defend the $80,000 support, but will it hold after the April 2 “Liberation Day” tariffs are announced by US President Donald Trump?"
3/31/2025,Bitcoin’s safe haven ambitions face a major market test as investors seek shelter in gold and bonds.
3/31/2025,Bitcoin fails to deliver this quarter as gold outperforms and US trade tariffs keep BTC price upside firmly off the menu as crypto traders brace for impact.
3/31/2025,"Coinbase users may have lost over $46 million in Bitcoin to phishing scams in March, according to ZachXBT."
3/31/2025,"BlackRock CEO Larry Fink warned in an annual letter that mounting US debt could drive investors toward Bitcoin, threatening the dollar’s global dominance."
3/31/2025,"US President Donald Trump’s sons partner with Hut 8 to launch American Bitcoin, aiming to build the world’s largest Bitcoin mining firm with strategic reserves."
3/31/2025,"With $870 million of inflows in the past two weeks, crypto ETPs have yet to reverse a continuing decline in total assets under management."
3/31/2025,Crypto investors shift into stablecoins and real-world assets as Trump’s April 2 trade tariffs spark volatility and macroeconomic uncertainty fears.
3/31/2025,Treasury managers would feel pressured to try a Bitcoin strategy for fear of repercussions if they missed out on potential gains.
3/31/2025,"Michael Saylor’s Strategy bought 22,000 BTC for nearly $2 billion despite concerns over Trump’s April 2 tariff announcement and rising market uncertainty."
3/31/2025,"US President Donald Trump’s trade war is affecting crypto markets, where his own family has significant investments. Meanwhile, DeFi hacks are costing the industry."
3/31/2025,"Bitcoin sees a tap higher into the last Wall Street trading session of Q1, but BTC price perspectives are far from convinced that the bears have lost control."
3/30/2025,"Bitcoin sees ten-day lows in weekend trading as most market participants stay braced for further BTC price losses — can whales save the day with $78,000 bids?"
3/30/2025,"River Financial CEO Alex Leishman argues that once an exchange lists ETH and SOL, it “makes no sense” not to list related crypto tokens from their ecosystems."
3/30/2025,Bridging assets from centralized to decentralized exchanges has typically been a cumbersome and difficult process for users.
3/30/2025,"Bitcoin bulls are expected to step in near $80,000. Will altcoin traders follow suit?"
3/30/2025,"Crypto industry professionals say US regulation must clarify banking and stablecoins before focusing on taxes, as Trump-backed reforms push crypto into the spotlight."
3/30/2025,"Bitcoin and stocks face pressure as Trump prepares new tariff announcements for April 2, sparking trade war fears and cooling investor risk appetite."
3/29/2025,"Sonic Labs scraps its algorithmic stablecoin and pivots to a dirham-based alternative, aligning with UAE’s digital currency rollout in late 2025."
3/29/2025,Corporate Bitcoin adoption remains limited by Europe’s “fragmented” regulatory regime and a smaller liquidity pool than the United States.
3/29/2025,"Analysts say central banks will expand liquidity in the near future, opening the door for Bitcoin price to make a push toward new all-time highs."
3/29/2025,Coin Bureau founder Nic Puckrin said he expects two 25 basis point rate cuts from the Federal Reserve in 2025 and no quantitative easing.
3/29/2025,The growing stablecoin supply suggests cryptocurrency adoption is at its mainstream “tipping point.”
3/28/2025,"Bitcoin is “more likely” to rally to $110,000 first, predicts Arthur Hayes, pointing to easing monetary policy in the US."
3/28/2025,"Bitcoin lost a key price support today, and one analyst says liquidity conditions forecast another BTC price drop to $72,000."
3/28/2025,GameStop's short sales volume hit its highest level in nine months amid doubts over its Bitcoin acquisition plans.
3/28/2025,Many analysts now say the four-year cycle driven by the Bitcoin halving is either dead or will have a blunted effect on markets.
3/28/2025,Bitcoin falls to its range lows as a fresh round of US tariffs spook markets and raise investors’ inflation fears.
3/28/2025,"A crypto analyst says Bitcoin may reach $123,000 by June in a best-case scenario if it tracks the average return from his DXY backtest."
3/28/2025,Bitcoin faces renewed inflation pressure as US PCE data beats expectations — can BTC price action maintain crucial support to avoid another trip to multimonth lows?
3/28/2025,"NFT sales dropped 63% year-over-year in Q1 2025, but Pudgy Penguins, Doodles and Milady Maker outperformed the broader market."
3/28/2025,"Bitcoin price metrics taking an extended break from bullish upside is “not great,” the creator of the Bitcoin Macro Index says, but hope remains for a comeback."
3/28/2025,South Carolina has dismissed its lawsuit against Coinbase related to its staking services — joining Vermont in a move described by the firm as a victory for American consumers.
3/28/2025,"Traders say Bitcoin is at risk of a sell-off to $65,000, but one analyst says a key price metric shows “whales going wild right now.”"
3/27/2025,"Crypto still has several years to go before achieving mainstream mass adoption, mirroring the internet experience of the late 1990s, says Polygon’s co-founder."
3/27/2025,Some Bitcoin advocates say that the cryptocurrency has gotten away from its roots as a payment instrument and has become more akin to digital gold.
3/27/2025,This week’s $16.5 billion Bitcoin options expiry could see BTC price swing in either direction.
3/27/2025,"According to analysts, the lukewarm response reflects concerns that GameStop may be trying to distract investors from deeper issues with its business model."
3/27/2025,"Bitcoin again fails to copy a gold rally as risk assets sag over US trade tariffs, but traders see BTC price gains taking the market past $90,000 next."
